[
  {
    "version": 2,
    "id": "ninjarobot-page-review-260907-01",
    "created_at": "2026-09-06T22:54:05Z",
    "actor": "agent:codex",
    "risk": "low",
    "summary": "Record the machine evidence review for NinjaRobotPi5 project overview.",
    "sources": [
      {
        "id": "src-20260906-knowledgeintegration",
        "content_hash": "sha256:dabd8421a326cd9a56ad3f4d4f1d902f2e0e146897546a43e37d021e8f27c71f"
      },
      {
        "id": "src-20260906-developmentguide",
        "content_hash": "sha256:80e65e182e818957c7938c055a4327b3f4c79a6807b38c7b05580248f77eb38e"
      }
    ],
    "operations": [
      {
        "op": "write",
        "path": "wiki/overview.md",
        "expected_sha256": "sha256:4c37a0c902e578d4561336d099341ba2c66cbc5f5f07e8591f1d16ea5a590ba3",
        "content": "---\ntype: Concept\ntitle: NinjaRobotPi5 project overview\ndescription: Start here for architecture, setup, features, development history, and\n  current evidence.\nstatus: draft\ntags:\n- ninjarobotpi5\ngenerated:\n  by: agent:codex\n  at: '2026-09-06T22:53:22Z'\nsources:\n- id: src-20260906-knowledgeintegration\n  resource: urn:llmwiki:source:src-20260906-knowledgeintegration\n  title: Local knowledge integration evidence\n  content_hash: sha256:dabd8421a326cd9a56ad3f4d4f1d902f2e0e146897546a43e37d021e8f27c71f\n- id: src-20260906-developmentguide\n  resource: urn:llmwiki:source:src-20260906-developmentguide\n  title: DevelopmentGuide.md\n  content_hash: sha256:80e65e182e818957c7938c055a4327b3f4c79a6807b38c7b05580248f77eb38e\nsemantic_review:\n  version: 1\n  performed_by: agent:codex\n  performed_at: '2026-09-06T22:54:05Z'\n  target_hash: sha256:82b4b2b09b867f0a069e05e4f7cf3bdee6bfcceaf4d79ec854857a8c998ebd69\n  result: passed\n  checks:\n    source_support: passed\n    contradictions: passed\n    limitations: passed\n    claim_strength: passed\n    visual_evidence: not_applicable\n  notes:\n  - Reviewed this page against its listed manual sections and integration evidence.\n  - Claims describe documented contracts and knowledge workflow; current hardware\n    operation and interactive editor activation are not certified.\n---\n\n# NinjaRobotPi5 project overview\n\nNinjaRobotPi5 documents an Agent layer for user/model interaction, an IDE layer\nfor coordinating devices, and managed Pi5 libraries for individual devices.\nThe development guide describes their permitted ownership boundary.[^src-20260906-developmentguide]\n\nThe local wiki is the primary developer knowledge collection. Full manuals are\nversioned under raw source folders; outer README links and the project knowledge\nmap identify the current versions. Read source records and limitations, then\ncompare important claims with the current checkout before coding.[^src-20260906-knowledgeintegration]\n\n## Browse project knowledge\n\n- [Architecture and hardware ownership](concepts/architecture.md)\n- [Development and documentation workflow](concepts/development-workflow.md)\n- [Installation and hardware checks](concepts/installation.md)\n- [Features, MCP tools, and Agent Skills](concepts/features-and-tools.md)\n- [Development history](concepts/development-history.md)\n- [Known knowledge limitations](analyses/knowledge-limitations.md)\n- [Installation manual](references/installation-guide.md)\n- [Development manual](references/development-guide.md)\n- [Development log](references/development-log.md)\n- [MCP and skills tutorial](references/mcp-skills-guide.md)\n\n\n[^src-20260906-knowledgeintegration]: Local knowledge integration evidence, source version `integration-2026-09-07`; registered source `src-20260906-knowledgeintegration`.\n[^src-20260906-developmentguide]: DevelopmentGuide.md, source version `migration-2026-09-07`; registered source `src-20260906-developmentguide`.\n"
      }
    ]
  },
  {
    "version": 2,
    "id": "ninjarobot-page-review-260907-02",
    "created_at": "2026-09-06T22:54:05Z",
    "actor": "agent:codex",
    "risk": "low",
    "summary": "Record the machine evidence review for Installation guide.",
    "sources": [
      {
        "id": "src-20260906-installationguide",
        "content_hash": "sha256:53f80c60feb139f0de547613bd14b8fcd87a2678ba5bf7dc75b1b2bccb1dc1c4"
      },
      {
        "id": "src-20260906-knowledgeintegration",
        "content_hash": "sha256:dabd8421a326cd9a56ad3f4d4f1d902f2e0e146897546a43e37d021e8f27c71f"
      }
    ],
    "operations": [
      {
        "op": "write",
        "path": "wiki/references/installation-guide.md",
        "expected_sha256": "sha256:b36e9940fabff1e246ba0d8b7edbe2dad5eac2e97cb4160fc27fccf07758a16d",
        "content": "---\ntype: Reference\ntitle: Installation guide\ndescription: Find the complete versioned installation guide.\nstatus: draft\ntags:\n- ninjarobotpi5\ngenerated:\n  by: agent:codex\n  at: '2026-09-06T22:53:22Z'\nsources:\n- id: src-20260906-installationguide\n  resource: urn:llmwiki:source:src-20260906-installationguide\n  title: InstallationGuide.md\n  content_hash: sha256:53f80c60feb139f0de547613bd14b8fcd87a2678ba5bf7dc75b1b2bccb1dc1c4\n- id: src-20260906-knowledgeintegration\n  resource: urn:llmwiki:source:src-20260906-knowledgeintegration\n  title: Local knowledge integration evidence\n  content_hash: sha256:dabd8421a326cd9a56ad3f4d4f1d902f2e0e146897546a43e37d021e8f27c71f\nsemantic_review:\n  version: 1\n  performed_by: agent:codex\n  performed_at: '2026-09-06T22:54:05Z'\n  target_hash: sha256:6d71976836ad0e8f100f5d4855e46a9ae345e99c159045e15ddf144ed969aa38\n  result: passed\n  checks:\n    source_support: passed\n    contradictions: passed\n    limitations: passed\n    claim_strength: passed\n    visual_evidence: not_applicable\n  notes:\n  - Reviewed this page against its listed manual sections and integration evidence.\n  - Claims describe documented contracts and knowledge workflow; current hardware\n    operation and interactive editor activation are not certified.\n---\n\n# Installation guide\n\nThe full guide covers beginner setup, hardware initialization and calibration, startup, and troubleshooting. Hardware commands require the stated operator precautions.[^src-20260906-installationguide]\n\nUse the source identifier below to resolve the complete manual through the raw\nsource catalog. The outer wiki README also links directly to the current full\nmanual. Root filenames are navigation pages; source updates create new versions.\nRead the relevant full section before acting on an abbreviated explanation.[^src-20260906-knowledgeintegration]\n\n[Return to project overview](/overview.md).\n\n[^src-20260906-installationguide]: InstallationGuide.md, source version `migration-2026-09-07`; registered source `src-20260906-installationguide`.\n[^src-20260906-knowledgeintegration]: Local knowledge integration evidence, source version `integration-2026-09-07`; registered source `src-20260906-knowledgeintegration`.\n"
      }
    ]
  },
  {
    "version": 2,
    "id": "ninjarobot-page-review-260907-03",
    "created_at": "2026-09-06T22:54:05Z",
    "actor": "agent:codex",
    "risk": "low",
    "summary": "Record the machine evidence review for Development guide.",
    "sources": [
      {
        "id": "src-20260906-developmentguide",
        "content_hash": "sha256:80e65e182e818957c7938c055a4327b3f4c79a6807b38c7b05580248f77eb38e"
      },
      {
        "id": "src-20260906-knowledgeintegration",
        "content_hash": "sha256:dabd8421a326cd9a56ad3f4d4f1d902f2e0e146897546a43e37d021e8f27c71f"
      }
    ],
    "operations": [
      {
        "op": "write",
        "path": "wiki/references/development-guide.md",
        "expected_sha256": "sha256:86f84c4b6aa30a9345057d86af6f287c43b79ea2615c3589f8316bd5239aab5a",
        "content": "---\ntype: Reference\ntitle: Development guide\ndescription: Find the complete versioned development guide.\nstatus: draft\ntags:\n- ninjarobotpi5\ngenerated:\n  by: agent:codex\n  at: '2026-09-06T22:53:22Z'\nsources:\n- id: src-20260906-developmentguide\n  resource: urn:llmwiki:source:src-20260906-developmentguide\n  title: DevelopmentGuide.md\n  content_hash: sha256:80e65e182e818957c7938c055a4327b3f4c79a6807b38c7b05580248f77eb38e\n- id: src-20260906-knowledgeintegration\n  resource: urn:llmwiki:source:src-20260906-knowledgeintegration\n  title: Local knowledge integration evidence\n  content_hash: sha256:dabd8421a326cd9a56ad3f4d4f1d902f2e0e146897546a43e37d021e8f27c71f\nsemantic_review:\n  version: 1\n  performed_by: agent:codex\n  performed_at: '2026-09-06T22:54:05Z'\n  target_hash: sha256:5c4426c3c590ca13735e31041528119c09a303e1b84cd8931d6c5286d741f068\n  result: passed\n  checks:\n    source_support: passed\n    contradictions: passed\n    limitations: passed\n    claim_strength: passed\n    visual_evidence: not_applicable\n  notes:\n  - Reviewed this page against its listed manual sections and integration evidence.\n  - Claims describe documented contracts and knowledge workflow; current hardware\n    operation and interactive editor activation are not certified.\n---\n\n# Development guide\n\nThe full guide describes architecture, managed drivers, configuration, safety, the behavior system, external tools, memory, web access, and development checks.[^src-20260906-developmentguide]\n\nUse the source identifier below to resolve the complete manual through the raw\nsource catalog. The outer wiki README also links directly to the current full\nmanual. Root filenames are navigation pages; source updates create new versions.\nRead the relevant full section before acting on an abbreviated explanation.[^src-20260906-knowledgeintegration]\n\n[Return to project overview](/overview.md).\n\n[^src-20260906-developmentguide]: DevelopmentGuide.md, source version `migration-2026-09-07`; registered source `src-20260906-developmentguide`.\n[^src-20260906-knowledgeintegration]: Local knowledge integration evidence, source version `integration-2026-09-07`; registered source `src-20260906-knowledgeintegration`.\n"
      }
    ]
  },
  {